{
  "$schema": "http://json-schema.org/draft-07/schema#",
  "title": "Canonical Candidate Profile",
  "type": "object",
  "properties": {
    "candidate_id": { "type": "string" },
    "full_name": { "type": "string" },
    "emails": { "type": "array", "items": { "type": "string" } },
    "phones": { "type": "array", "items": { "type": "string" } },
    "location": {
      "type": "object",
      "properties": {
        "city": { "type": ["string", "null"] },
        "region": { "type": ["string", "null"] },
        "country": { "type": ["string", "null"] }
      }
    },
    "links": {
      "type": "object",
      "properties": {
        "linkedin": { "type": ["string", "null"] },
        "github": { "type": ["string", "null"] },
        "portfolio": { "type": ["string", "null"] },
        "other": { "type": "array", "items": { "type": "string" } }
      }
    },
    "headline": { "type": ["string", "null"] },
    "years_experience": { "type": ["number", "null"] },
    "skills": {
      "type": "array",
      "items": {
        "type": "object",
        "properties": {
          "name": { "type": "string" },
          "confidence": { "type": "number" },
          "sources": { "type": "array", "items": { "type": "string" } }
        }
      }
    },
    "experience": {
      "type": "array",
      "items": {
        "type": "object",
        "properties": {
          "company": { "type": ["string", "null"] },
          "title": { "type": ["string", "null"] },
          "start": { "type": ["string", "null"] },
          "end": { "type": ["string", "null"] },
          "summary": { "type": ["string", "null"] }
        }
      }
    },
    "education": {
      "type": "array",
      "items": {
        "type": "object",
        "properties": {
          "institution": { "type": ["string", "null"] },
          "degree": { "type": ["string", "null"] },
          "field": { "type": ["string", "null"] },
          "end_year": { "type": ["integer", "null"] }
        }
      }
    },
    "provenance": {
      "type": "array",
      "items": {
        "type": "object",
        "properties": {
          "field": { "type": "string" },
          "source": { "type": "string" },
          "method": { "type": "string" }
        }
      }
    },
    "overall_confidence": { "type": "number" }
  },
  "additionalProperties": false
}
